{
  "schema": "wtfp.evaluation.budget-matrix/v1",
  "id": "primary-client-routing",
  "version": 1,
  "currency": "USD",
  "rows": [
    {
      "id": "claude-sonnet-primary",
      "status": "planned",
      "study_kind": "routing-behavior",
      "evidence_interpretation": "Typed Skill events can establish implicit skill loading; explicit selector/action resolution and separate model-version identity remain capability-inconclusive when native events do not expose them.",
      "evidence_level": "paid-model",
      "client": { "name": "Claude Code", "version": "2.1.251", "commit": null },
      "model": { "id": "claude-sonnet-5", "version": "5" },
      "adapter_target": "claude",
      "selector_profile": "claude",
      "required_claims": ["selector-accepted", "route-skill", "route-action", "activation", "cost"],
      "effort": "xhigh",
      "permission_policy": "routing-only read-only execution; stop after the first independently observable route",
      "environment_policy": "fresh mode-0700 project, HOME, XDG roots, temporary directory, and client state for every case; no shared session",
      "allow_substitution": false,
      "case_ids": [
        "start-clear-new-paper",
        "research-paraphrase-bibliography",
        "plan-clear-section",
        "write-clear-section",
        "review-clear-section",
        "manage-clear-pause",
        "deliver-paraphrase-poster",
        "plan-boundary-software-rollout",
        "write-negative-brainstorm",
        "review-neighbor-delivery",
        "operation-help",
        "explicit-new-paper",
        "explicit-analyze-bib",
        "explicit-plan-section",
        "explicit-write-section",
        "explicit-review-section",
        "explicit-pause-writing",
        "explicit-create-poster"
      ],
      "maximum_paid_cases": 18,
      "cost_policy": { "status": "metered", "maximum_usd": 3 },
      "rationale": "Run the shared cross-client core: all seven academic owners implicitly and explicitly, plus negative, boundary, neighbor, and product-operation probes."
    },
    {
      "id": "codex-gpt54-primary",
      "status": "planned",
      "study_kind": "capability-and-behavior",
      "evidence_interpretation": "This is a requested-surface capability and safety-behavior study, not native activation evidence: stable Codex JSONL exposes no typed route, skill activation, selector-resolution, priced USD, or backend-model identity signal; retained prose is descriptive only.",
      "evidence_level": "paid-model",
      "client": { "name": "Codex CLI", "version": "0.144.1", "commit": null },
      "model": { "id": "gpt-5.4", "version": "5.4" },
      "adapter_target": "codex",
      "selector_profile": "codex",
      "required_claims": ["selector-accepted", "route-skill"],
      "effort": "xhigh",
      "permission_policy": "routing-only read-only execution; stop after the first independently observable route",
      "environment_policy": "fresh mode-0700 project, HOME, XDG roots, temporary directory, and client state for every case; no shared session",
      "allow_substitution": false,
      "case_ids": [
        "start-clear-new-paper",
        "research-paraphrase-bibliography",
        "plan-clear-section",
        "write-clear-section",
        "review-clear-section",
        "manage-clear-pause",
        "deliver-paraphrase-poster",
        "plan-boundary-software-rollout",
        "write-negative-brainstorm",
        "review-neighbor-delivery",
        "operation-help",
        "explicit-new-paper",
        "explicit-analyze-bib",
        "explicit-plan-section",
        "explicit-write-section",
        "explicit-review-section",
        "explicit-pause-writing",
        "explicit-create-poster"
      ],
      "maximum_paid_cases": 18,
      "cost_policy": { "status": "unavailable", "maximum_usd": null },
      "rationale": "Run the shared cross-client core: all seven academic owners implicitly and explicitly, plus negative, boundary, neighbor, and product-operation probes."
    },
    {
      "id": "clio-terra-primary",
      "status": "planned",
      "study_kind": "routing-behavior",
      "evidence_interpretation": "Native suggestion, sealed activation state, explicit expansion, argument, and bound-resource evidence are scored separately; the receipt proves wire model id but not a separate model-version field.",
      "evidence_level": "paid-model",
      "client": { "name": "Clio Coder", "version": "0.3.8", "commit": "9b7b80ccbd3d2211d4079bc76558bb06d66a8583" },
      "model": { "id": "gpt-5.6-terra", "version": "5.6-terra" },
      "adapter_target": "clio",
      "selector_profile": "clio",
      "required_claims": ["selector-accepted", "route-skill", "route-action", "suggestion", "activation", "arguments", "resources", "cost"],
      "effort": "xhigh",
      "permission_policy": "routing-only read-only execution; stop after the first independently observable route",
      "environment_policy": "fresh mode-0700 project, HOME, XDG roots, temporary directory, and client state for every case; no shared session",
      "allow_substitution": false,
      "case_ids": [
        "start-clear-new-paper",
        "research-paraphrase-bibliography",
        "plan-clear-section",
        "write-clear-section",
        "review-clear-section",
        "manage-clear-pause",
        "deliver-paraphrase-poster",
        "plan-boundary-software-rollout",
        "write-negative-brainstorm",
        "review-neighbor-delivery",
        "operation-help",
        "explicit-new-paper",
        "explicit-analyze-bib",
        "explicit-plan-section",
        "explicit-write-section",
        "explicit-review-section",
        "explicit-pause-writing",
        "explicit-create-poster"
      ],
      "maximum_paid_cases": 18,
      "cost_policy": { "status": "unavailable", "maximum_usd": null },
      "rationale": "Run the shared cross-client core: all seven academic owners implicitly and explicitly, plus negative, boundary, neighbor, and product-operation probes."
    },
    {
      "id": "codex-gpt56-chatgpt-auth",
      "status": "unavailable",
      "study_kind": "unavailable-target",
      "evidence_interpretation": "No behavioral or activation evidence exists for this exact unavailable target, and no substitute model is relabeled as GPT-5.6.",
      "evidence_level": "paid-model",
      "client": { "name": "Codex CLI", "version": "0.144.1", "commit": null },
      "model": { "id": "gpt-5.6", "version": "5.6" },
      "adapter_target": "codex",
      "selector_profile": "codex",
      "required_claims": [],
      "effort": "xhigh",
      "permission_policy": "routing-only read-only execution; exact target unavailable through the authenticated route",
      "environment_policy": "no execution performed because the exact historical target was unavailable",
      "allow_substitution": false,
      "case_ids": [],
      "maximum_paid_cases": 0,
      "cost_policy": { "status": "unavailable", "maximum_usd": null },
      "rationale": "Retain the exact requested historical target instead of relabeling a different model as GPT-5.6.",
      "reason": "The exact GPT-5.6 target was unavailable through this Codex CLI ChatGPT-auth route."
    },
    {
      "id": "copilot-paid-secondary",
      "status": "skipped",
      "study_kind": "native-static-only",
      "evidence_interpretation": "Only static and credential-free native discovery evidence is in scope; no paid behavioral or activation claim is made for this row.",
      "evidence_level": "paid-model",
      "client": { "name": "GitHub Copilot", "version": "current-native-validator", "commit": null },
      "model": { "id": "not-requested", "version": "not-requested" },
      "adapter_target": "copilot",
      "selector_profile": null,
      "required_claims": [],
      "effort": "not-applicable",
      "permission_policy": "not applicable; paid execution deliberately skipped",
      "environment_policy": "no paid execution; static and native validation use disposable profiles",
      "allow_substitution": false,
      "case_ids": [],
      "maximum_paid_cases": 0,
      "cost_policy": { "status": "unavailable", "maximum_usd": null },
      "rationale": "Reserve paid routing evidence for the three primary surfaces while retaining native and static validation elsewhere.",
      "reason": "A paid run adds less evidence than the budgeted Claude, Codex, and Clio matrix for this release candidate."
    }
  ]
}
